{
  "meta": {
    "blueprint_id": "sick_instandhaltung_act_05",
    "schema_version": "1.0",
    "language": "de",
    "product_layer": "closure"
  },
  "act": 5,
  "story": {
    "core_message_de": "Rückblick auf einen Stör- und Audit-Tag in der Food-Produktion + Take-home für {{company.name}}.",
    "core_message_en": "Recap of a disruption and audit day in food production + take-home for SICK.",
    "user_feeling": "Abschluss, Klarheit, Neugier auf Report",
    "nova_role": "Synthese, dann klare Handlungsaufforderung (QR)"
  },
  "environment": {
    "environment_id": "env_void_constellation_sick_v1",
    "world_slug": "void-constellation",
    "scene_concept_de": "Void mit leuchtender Constellation und QR-Panel für den Session-Report.",
    "setting_class": "void_constellation",
    "style_hint": "abstract stars, persona graph, industrial accent nodes",
    "region_hint": "neutral",
    "time_of_day": "neutral",
    "lighting_preset": "void_minimal"
  },
  "image_prompts": {
    "splat_world": {
      "slug_hint": "void-constellation",
      "prompt_en": "Abstract dark space, floating persona constellation nodes, QR panel at eye level, subtle industrial accent lights suggesting conveyor and sensor motifs, minimal stars, cinematic",
      "negative_prompt": "kitchen, office, filling line clutter, daylight window",
      "camera_notes": "qr_panel anchor floating at comfortable reading distance",
      "anchor_placements": [{ "anchor_id": "qr_panel", "description": "Floating QR / report panel" }]
    },
    "prop_notes": "QR code 3D prop; persona node constellation with production/sensor motif"
  },
  "voiceover": {
    "pre_beat_tracks": [],
    "beat_track": {
      "track_id_suffix": "01",
      "estimated_duration_sec": 22,
      "lines": [
        {
          "text": "Du hast {{persona.display_name}} fünf Minuten lang erlebt.",
          "at_sec": 0,
          "pause_after_sec": 0.5
        },
        {
          "text": "echeon, CHECKION, AUDION — ein Stör- und Audit-Tag aus seiner Perspektive.",
          "at_sec": 5,
          "pause_after_sec": 0.5
        },
        {
          "text": "Scanne den Code — dein Report für {{company.name}} wartet.",
          "at_sec": 12,
          "pause_after_sec": 0.6
        }
      ]
    }
  },
  "interaction": {
    "trigger_type": "timer",
    "trigger_target": "qr_panel",
    "primary_anchor": "qr_panel",
    "delay_sec": 5,
    "haptic_pattern": "none"
  },
  "data_viz": {
    "mode": "qr_closure",
    "qr_closure": { "anchor_object": "qr_panel" }
  },
  "timeline": {
    "target_duration_sec": 45,
    "ambient_audio_id": null,
    "pre_beat_cues": [
      { "type": "overlay_show", "at_sec": 17 },
      { "type": "session_complete", "at_sec": 38 }
    ],
    "beat_cue_templates": []
  }
}
