{
  "meta": {
    "blueprint_id": "product_default_act_01",
    "schema_version": "1.0",
    "language": "de",
    "product_layer": "onboarding"
  },
  "act": 1,
  "story": {
    "core_message_de": "Identitätswechsel — du wirst jemand anderes, der Tag beginnt.",
    "core_message_en": "Identity shift — you become someone else; the day begins.",
    "user_feeling": "Neugier, leichte Unsicherheit, Fokus auf Spiegel/Transformation",
    "nova_role": "Einladend, präzise, nicht verkäuferisch — zwischen den Handlungen sprechen"
  },
  "environment": {
    "environment_id": "env_void_mirror_v1",
    "world_slug": "void-mirror",
    "scene_concept_de": "Schwarzer Void mit Spiegel — Identitätswechsel, keine Alltagskulisse.",
    "setting_class": "void_minimal",
    "style_hint": "abstract mirror, minimal geometry",
    "region_hint": "neutral",
    "time_of_day": "neutral",
    "lighting_preset": "void_minimal"
  },
  "image_prompts": {
    "splat_world": {
      "slug_hint": "void-mirror-pilot",
      "prompt_en": "Abstract minimal void room with a tall vertical mirror surface, soft rim light, photorealistic, no furniture, dark floor, subtle fog, cinematic, 360 equirectangular interior",
      "negative_prompt": "clutter, people, text, logos, outdoor",
      "camera_notes": "User faces mirror at eye level; avatar reveal centered in reflection",
      "anchor_placements": [
        { "anchor_id": "mirror_center", "description": "Center of mirror plane, 1.45m height" }
      ]
    },
    "prop_notes": "RPM avatar morph target at mirror; no product UI"
  },
  "voiceover": {
    "pre_beat_tracks": [],
    "beat_track": {
      "track_id_suffix": "01",
      "estimated_duration_sec": 12,
      "lines": [
        { "text": "Willkommen bei Persona Reality.", "at_sec": 0, "pause_after_sec": 0.5 },
        {
          "text": "Gleich wirst du jemand anderem — {{persona.display_name}}, {{persona.occupation}} aus {{persona.location}}.",
          "at_sec": 4,
          "pause_after_sec": 0.5
        },
        { "text": "Schau in den Spiegel. Das ist dein Morgen.", "at_sec": 9, "pause_after_sec": 0.6 }
      ]
    }
  },
  "interaction": {
    "trigger_type": "scene_enter",
    "trigger_target": null,
    "primary_anchor": "mirror_center",
    "delay_sec": 2,
    "haptic_pattern": "none"
  },
  "data_viz": { "mode": "none" },
  "timeline": {
    "target_duration_sec": 14,
    "ambient_audio_id": null,
    "pre_beat_cues": [
      { "type": "subtitle", "track_id": "PLACEHOLDER", "at_sec": 0 },
      { "type": "fade", "at_sec": 13, "duration_sec": 0.6, "mode": "out" },
      { "type": "act_advance", "at_sec": 14 }
    ],
    "beat_cue_templates": []
  }
}
