{
  "meta": {
    "blueprint_id": "product_default_act_05",
    "schema_version": "1.0",
    "language": "de",
    "product_layer": "closure"
  },
  "act": 5,
  "story": {
    "core_message_de": "Rückblick auf den Tag + Take-home — die drei Produktschichten im Kontext.",
    "core_message_en": "Day recap + take-home — three product layers in context.",
    "user_feeling": "Abschluss, Klarheit, Neugier auf Report",
    "nova_role": "Synthese, dann klare Handlungsaufforderung (QR)"
  },
  "environment": {
    "environment_id": "env_void_constellation_v1",
    "world_slug": "void-constellation",
    "scene_concept_de": "Void mit Sternfeld und QR-Panel — Abschluss ohne Alltagsraum.",
    "setting_class": "void_constellation",
    "style_hint": "abstract stars, persona graph",
    "region_hint": "neutral",
    "time_of_day": "neutral",
    "lighting_preset": "void_minimal"
  },
  "image_prompts": {
    "splat_world": {
      "slug_hint": "void-constellation",
      "prompt_en": "Abstract dark void with glowing constellation points, subtle depth, minimalist, no furniture, cinematic space for QR panel and persona graph nodes",
      "negative_prompt": "kitchen, office, daylight window",
      "camera_notes": "qr_panel anchor floating at comfortable reading distance",
      "anchor_placements": [{ "anchor_id": "qr_panel", "description": "Floating QR / report panel" }]
    },
    "prop_notes": "QR code 3D prop; optional persona node constellation"
  },
  "voiceover": {
    "pre_beat_tracks": [],
    "beat_track": {
      "track_id_suffix": "01",
      "estimated_duration_sec": 18,
      "lines": [
        {
          "text": "Du hast {{persona.display_name}} fünf Minuten lang erlebt.",
          "at_sec": 0,
          "pause_after_sec": 0.5
        },
        {
          "text": "echeon, CHECKION, AUDION — ein Tag aus seiner Perspektive.",
          "at_sec": 5,
          "pause_after_sec": 0.5
        },
        { "text": "Scanne den Code — dein Report wartet.", "at_sec": 11, "pause_after_sec": 0.6 }
      ]
    }
  },
  "interaction": {
    "trigger_type": "timer",
    "trigger_target": null,
    "primary_anchor": "qr_panel",
    "delay_sec": 5,
    "haptic_pattern": "none"
  },
  "data_viz": {
    "mode": "qr_closure",
    "qr_closure": { "anchor_object": "qr_panel" }
  },
  "timeline": {
    "target_duration_sec": 45,
    "ambient_audio_id": null,
    "pre_beat_cues": [],
    "beat_cue_templates": []
  }
}
