{
  "meta": {
    "blueprint_id": "product_default_act_02",
    "schema_version": "1.0",
    "language": "de",
    "product_layer": "echeon"
  },
  "act": 2,
  "story": {
    "core_message_de": "Der Tag startet mit kuratiertem, relevantem Input — was die Rolle wirklich beschäftigt.",
    "core_message_en": "The day starts with curated, relevant input — what matters to this role.",
    "user_feeling": "Informiert, leicht unter Druck, Morgenrhythmus",
    "nova_role": "Kontext geben, dann schweigen während Feed-Lesen"
  },
  "environment": {
    "environment_id": "env_kitchen_lived_in_dach_v1",
    "world_slug": "tik-kitchen-pilot",
    "scene_concept_de": "Legacy-Referenz: DACH-Küche am Morgen — nur nutzen wenn die Persona dort sinnvoll startet.",
    "setting_class": "home_kitchen",
    "style_hint": "lived_in_casual, DACH morning",
    "region_hint": "dach",
    "time_of_day": "07:15",
    "lighting_preset": "morning_warm"
  },
  "image_prompts": {
    "splat_world": {
      "slug_hint": "tik-kitchen-pilot",
      "prompt_en": "Lived-in DACH apartment kitchen morning, warm daylight, wooden counters, coffee cup, papers on table, phone on counter, photorealistic 360 interior, cozy but professional",
      "negative_prompt": "empty showroom, night, sci-fi, blur",
      "camera_notes": "Phone anchor on counter within arm reach; calendar on wall visible",
      "anchor_placements": [
        { "anchor_id": "phone_main", "description": "Smartphone on kitchen counter" },
        { "anchor_id": "wall_calendar", "description": "Wall calendar near kitchen" }
      ]
    },
    "prop_notes": "Phone prop + hotspot for pickup interaction"
  },
  "voiceover": {
    "pre_beat_tracks": [
      {
        "track_id_suffix": "01",
        "estimated_duration_sec": 18,
        "lines": [
          {
            "text": "Sieben Uhr — Küche in deinem MFH in {{persona.location}}.",
            "at_sec": 0,
            "pause_after_sec": 0.5
          },
          {
            "text": "Die Nebenkostenabrechnung liegt noch auf dem Tisch.",
            "at_sec": 5,
            "pause_after_sec": 0.5
          },
          {
            "text": "Dein Handy vibriert. Der Tag beginnt mit Informationen.",
            "at_sec": 11,
            "pause_after_sec": 0.6
          }
        ]
      }
    ],
    "beat_track": {
      "track_id_suffix": "02",
      "estimated_duration_sec": 20,
      "lines": [
        {
          "text": "Das ist dein echeon-Feed — kuratiert für {{persona.occupation}} wie dich.",
          "at_sec": 0,
          "pause_after_sec": 0.5
        },
        {
          "text": "Förderungen, SHK-News, alles was deine Eigentümer beschäftigt.",
          "at_sec": 6,
          "pause_after_sec": 0.6
        }
      ]
    }
  },
  "interaction": {
    "trigger_type": "pickup",
    "trigger_target": "phone_main",
    "primary_anchor": "phone_main",
    "delay_sec": 0,
    "haptic_pattern": "soft_pulse"
  },
  "data_viz": {
    "mode": "echeon_feed",
    "echeon_feed": {
      "item_count": 3,
      "categories": ["regulation", "technology", "market"],
      "headline_templates": [
        "Förderung 2026: Was {{persona.occupation}} jetzt wissen müssen",
        "Wärmepumpen in Bestands-MFH: Praxisbericht",
        "Eigentümerversammlung: neue Pflichten im Überblick"
      ]
    }
  },
  "timeline": {
    "target_duration_sec": 60,
    "ambient_audio_id": "kitchen_morning_loop",
    "pre_beat_cues": [
      { "type": "ambient", "ambient_audio_id": "kitchen_morning_loop", "action": "start", "at_sec": 0 },
      { "type": "subtitle", "track_id": "PLACEHOLDER", "at_sec": 0 },
      { "type": "hint_primary", "anchor_object": "phone_main", "at_sec": 15 }
    ],
    "beat_cue_templates": [
      { "type": "hint_hide", "anchor_object": "phone_main", "at_sec": 0, "delay_from_beat": true },
      { "type": "overlay_show", "at_sec": 6, "delay_from_beat": true },
      { "type": "overlay_hide", "at_sec": 18, "delay_from_beat": true },
      { "type": "act_advance", "at_sec": 22, "delay_from_beat": true }
    ]
  }
}
