{
  "meta": {
    "blueprint_id": "sick_instandhaltung_act_02",
    "schema_version": "1.0",
    "language": "de",
    "product_layer": "echeon"
  },
  "act": 2,
  "story": {
    "core_message_de": "Die Linie steht — der Frühschicht-Start bringt kuratierten Fach-Input zu Stillstand, Sensorik und Audit.",
    "core_message_en": "The line is down — early shift starts with curated input on downtime, sensors, and audit.",
    "user_feeling": "Unter Druck, informiert, Werk-Realität",
    "nova_role": "Kontext geben, dann schweigen während Feed-Lesen am Wartungswagen"
  },
  "environment": {
    "environment_id": "env_sick_filling_line_stoppage_early_v1",
    "world_slug": "sick-filling-line-stoppage",
    "scene_concept_de": "Abfülllinie in der Frühschicht: rote HMI-Meldung, leere Flaschenbahn, Wartungswagen mit Tablet neben Förderstrecke, Feuchtraum-Beleuchtung, Hygiene-Schilder an Edelstahlverkleidung.",
    "setting_class": "industrial_floor",
    "style_hint": "hygienic, stainless, lived_in production",
    "region_hint": "dach",
    "time_of_day": "05:45",
    "lighting_preset": "morning_warm"
  },
  "image_prompts": {
    "splat_world": {
      "slug_hint": "sick-filling-line-stoppage",
      "prompt_en": "Photorealistic beverage filling line early morning, stainless steel hygienic environment, stopped conveyor with red HMI alarm visible, maintenance cart with tablet showing news feed area, empty bottles lane, wet floor reflections, DACH food plant scale, 360 industrial interior",
      "negative_prompt": "home kitchen, sofa, office desk, living room, bright showroom",
      "camera_notes": "Tablet on maintenance cart within arm reach; HMI alarm panel visible left",
      "anchor_placements": [
        { "anchor_id": "maintenance_tablet_cart", "description": "Rugged tablet mounted on maintenance cart" },
        { "anchor_id": "line_hmi_alarm_panel", "description": "Line HMI with red fault alarm" },
        { "anchor_id": "conveyor_guard_rail", "description": "Stainless guard rail along stopped conveyor" }
      ]
    },
    "prop_notes": "Tablet prop + pickup hotspot; red HMI state on panel"
  },
  "voiceover": {
    "pre_beat_tracks": [
      {
        "track_id_suffix": "01",
        "estimated_duration_sec": 22,
        "lines": [
          {
            "text": "Kurz vor sechs — Abfüllhalle in {{persona.location}}. Die Linie steht.",
            "at_sec": 0,
            "pause_after_sec": 0.5
          },
          {
            "text": "Rote Meldung am HMI. IFS-Audit in zwei Tagen. Jede Minute zählt.",
            "at_sec": 6,
            "pause_after_sec": 0.5
          },
          {
            "text": "Am Wartungswagen wartet dein Tablet. Der Tag beginnt mit Informationen.",
            "at_sec": 14,
            "pause_after_sec": 0.6
          }
        ]
      }
    ],
    "beat_track": {
      "track_id_suffix": "02",
      "estimated_duration_sec": 22,
      "lines": [
        {
          "text": "Das ist dein echeon-Feed — kuratiert für {{persona.occupation}} wie dich.",
          "at_sec": 0,
          "pause_after_sec": 0.5
        },
        {
          "text": "Stillstände, Sensorik, Audit-Vorbereitung — was Food-Produktion heute bewegt.",
          "at_sec": 6,
          "pause_after_sec": 0.6
        }
      ]
    }
  },
  "interaction": {
    "trigger_type": "pickup",
    "trigger_target": "maintenance_tablet_cart",
    "primary_anchor": "maintenance_tablet_cart",
    "delay_sec": 0,
    "haptic_pattern": "soft_pulse"
  },
  "data_viz": {
    "mode": "echeon_feed",
    "echeon_feed": {
      "item_count": 3,
      "categories": ["operations", "technology", "regulation"],
      "headline_templates": [
        "Predictive Maintenance in Abfülllinien: Was {{persona.occupation}} bei Vibrationssensorik beachten müssen",
        "IFS-Audit-Vorbereitung: Dokumentationslücken nach ungeplantem CIP — Branchenpraxis",
        "Fehlalarme an Förderstrecken: Wann Objekterkennung neu kalibriert werden muss"
      ]
    }
  },
  "timeline": {
    "target_duration_sec": 60,
    "ambient_audio_id": null,
    "pre_beat_cues": [
      { "type": "subtitle", "track_id": "PLACEHOLDER", "at_sec": 0 },
      { "type": "hint_primary", "anchor_object": "maintenance_tablet_cart", "at_sec": 18 }
    ],
    "beat_cue_templates": [
      { "type": "hint_hide", "anchor_object": "maintenance_tablet_cart", "at_sec": 0, "delay_from_beat": true },
      { "type": "overlay_show", "at_sec": 6, "delay_from_beat": true },
      { "type": "overlay_hide", "at_sec": 18, "delay_from_beat": true },
      { "type": "act_advance", "at_sec": 22, "delay_from_beat": true }
    ]
  }
}
